{
  "version": "0.5",
  "sampleRate": 48000,
  "timeUnit": "seconds",
  "metadata": {
    "title": "LUSID Test Scene",
    "author": "LUSID v0.5 spec",
    "sourceFormat": "ADM",
    "notes": "Direct speakers (incl LFE), two audio objects (one moving), spectral features on group 11, agent state on group 12."
  },
  "frames": [
    {
      "time": 0.0,
      "nodes": [
        {
          "id": "1.1",
          "type": "direct_speaker",
          "cart": [-1.0, 1.0, 0.0],
          "speakerLabel": "RC_L",
          "channelID": "AC_00011001"
        },
        {
          "id": "2.1",
          "type": "direct_speaker",
          "cart": [1.0, 1.0, 0.0],
          "speakerLabel": "RC_R",
          "channelID": "AC_00011002"
        },
        {
          "id": "3.1",
          "type": "direct_speaker",
          "cart": [0.0, 1.0, 0.0],
          "speakerLabel": "RC_C",
          "channelID": "AC_00011003"
        },
        {
          "id": "4.1",
          "type": "LFE"
        },
        {
          "id": "11.1",
          "type": "audio_object",
          "cart": [0.0, 1.0, 0.0]
        },
        {
          "id": "11.2",
          "type": "spectral_features",
          "centroid": 5000.0,
          "flux": 0.15,
          "bandwidth": 2200.0
        },
        {
          "id": "12.1",
          "type": "audio_object",
          "cart": [1.0, 0.0, 0.0]
        },
        {
          "id": "12.2",
          "type": "agent_state",
          "mood": "calm",
          "intensity": 0.3
        }
      ]
    },
    {
      "time": 0.5,
      "nodes": [
        {
          "id": "11.1",
          "type": "audio_object",
          "cart": [0.3, 0.9, 0.1]
        },
        {
          "id": "11.2",
          "type": "spectral_features",
          "centroid": 5200.0,
          "flux": 0.12,
          "bandwidth": 2100.0
        },
        {
          "id": "12.1",
          "type": "audio_object",
          "cart": [0.7, -0.7, 0.0]
        },
        {
          "id": "12.2",
          "type": "agent_state",
          "mood": "alert",
          "intensity": 0.5
        }
      ]
    },
    {
      "time": 1.0,
      "nodes": [
        {
          "id": "11.1",
          "type": "audio_object",
          "cart": [0.7, 0.7, 0.2]
        },
        {
          "id": "11.2",
          "type": "spectral_features",
          "centroid": 5800.0,
          "flux": 0.25,
          "bandwidth": 2400.0
        },
        {
          "id": "12.1",
          "type": "audio_object",
          "cart": [-0.5, 0.5, 0.0]
        },
        {
          "id": "12.2",
          "type": "agent_state",
          "mood": "excited",
          "intensity": 0.8
        }
      ]
    },
    {
      "time": 2.0,
      "nodes": [
        {
          "id": "11.1",
          "type": "audio_object",
          "cart": [-0.5, 0.8, 0.3]
        },
        {
          "id": "12.1",
          "type": "audio_object",
          "cart": [-1.0, 0.0, 0.0]
        }
      ]
    },
    {
      "time": 3.5,
      "nodes": [
        {
          "id": "11.1",
          "type": "audio_object",
          "cart": [0.0, 1.0, 0.0]
        },
        {
          "id": "12.1",
          "type": "audio_object",
          "cart": [0.0, -1.0, 0.0]
        }
      ]
    }
  ]
}
